{
  "manifest_version": "1",
  "id": "clawmaster.org/install",
  "name": "ClawMaster",
  "homepage": "https://clawmaster.org",
  "docs": "https://docs.clawmaster.org",
  "discovery": {
    "llms_txt_uri": "https://clawmaster.org/llms.txt",
    "agent_card_uri": "https://clawmaster.org/.well-known/agent-card.json",
    "api_catalog_uri": "https://clawmaster.org/.well-known/api-catalog"
  },
  "release_channels": {
    "default_channel": "stable",
    "channels": {
      "stable": {
        "manifest": "https://clawmaster.org/.well-known/clawmaster-install/channels/stable.json"
      }
    }
  },
  "install": {
    "strategy": "shell_script",
    "script_url": "https://www.clawmaster.org/install.sh",
    "command_preview": "curl -fsSL https://www.clawmaster.org/install.sh | sh",
    "release_manifest_schema": "https://clawmaster.org/.well-known/clawmaster-install.release.schema.json",
    "verify": {
      "release_page_url": "https://github.com/clawmaster-org/clawmaster/releases"
    }
  },
  "post_install": [
    {
      "id": "openclaw-detect",
      "description": "Detect an OpenClaw installation and collect import inventory",
      "run": [
        "clawmaster",
        "import",
        "detect",
        "--json"
      ],
      "optional": true
    },
    {
      "id": "openclaw-import",
      "description": "Import OpenClaw identity/providers/skills/memory/channels/sessions/mcp",
      "run": [
        "clawmaster",
        "import",
        "all",
        "--json"
      ],
      "optional": true
    }
  ],
  "start": {
    "run": [
      "clawmaster",
      "gateway",
      "--bind",
      "0.0.0.0",
      "--port",
      "13131"
    ],
    "url_hint": "http://<host>:13131",
    "healthchecks": [
      {
        "type": "http",
        "url": "http://127.0.0.1:13131/api/gon",
        "timeout_seconds": 8
      }
    ]
  },
  "handoff": {
    "user_message_template": "ClawMaster is ready. Please visit {url} to complete setup and sign in."
  }
}
